{
  "t_arrow_build_cost": 100.0,
  "t_arrow_max_level": 15.0,
  "t_arrow_base_dps": 30.0,
  "t_arrow_growth": 1.15,
  "t_arrow_range": 140.0,
  "t_arrow_attack_speed": 1.5,
  "t_arrow_sell_refund_rate": 0.7,
  "t_cannon_build_cost": 160.0,
  "t_cannon_max_level": 15.0,
  "t_cannon_base_dps": 45.0,
  "t_cannon_growth": 1.18,
  "t_cannon_range": 130.0,
  "t_cannon_attack_speed": 0.8,
  "t_cannon_sell_refund_rate": 0.7,
  "t_ice_build_cost": 120.0,
  "t_ice_max_level": 12.0,
  "t_ice_base_dps": 18.0,
  "t_ice_growth": 1.15,
  "t_ice_range": 120.0,
  "t_ice_attack_speed": 1.0,
  "t_ice_sell_refund_rate": 0.7,
  "t_wind_build_cost": 140.0,
  "t_wind_max_level": 12.0,
  "t_wind_base_dps": 22.0,
  "t_wind_growth": 1.16,
  "t_wind_range": 110.0,
  "t_wind_attack_speed": 1.2,
  "t_wind_sell_refund_rate": 0.7,
  "t_magic_build_cost": 200.0,
  "t_magic_max_level": 18.0,
  "t_magic_base_dps": 60.0,
  "t_magic_growth": 1.2,
  "t_magic_range": 150.0,
  "t_magic_attack_speed": 1.0,
  "t_magic_sell_refund_rate": 0.7,
  "t_poison_build_cost": 180.0,
  "t_poison_max_level": 15.0,
  "t_poison_base_dps": 25.0,
  "t_poison_growth": 1.17,
  "t_poison_range": 120.0,
  "t_poison_attack_speed": 1.0,
  "t_poison_sell_refund_rate": 0.7,
  "t_electric_build_cost": 220.0,
  "t_electric_max_level": 18.0,
  "t_electric_base_dps": 35.0,
  "t_electric_growth": 1.19,
  "t_electric_range": 140.0,
  "t_electric_attack_speed": 1.3,
  "t_electric_sell_refund_rate": 0.7,
  "cdx_src_t_arrow_base_dps": 30.0,
  "cdx_src_t_arrow_base_range": 140.0,
  "cdx_src_t_magic_base_dps": 60.0,
  "cdx_src_t_magic_base_range": 150.0,
  "cdx_src_t_wind_base_dps": 22.0,
  "cdx_src_t_wind_base_range": 110.0,
  "cdx_src_t_wind_growth": 1.16
}